{"checks":[{"action":{"argv":[],"label":"Start local ComfyUI and run the approved boke workflow","type":"human"},"arguments":{"bindings":"inputs/bindings.json","endpoint":"http://127.0.0.1:8188","execution_profile":"inputs/execution-profile.json","manifest":"artifacts/comfyui/boke/execution-manifest.json","model_profile":"inputs/model-profile.json","output_root":"artifacts/comfyui","request":"inputs/boke/generation-request.json","tool_profile":"inputs/tool-profile.json","workflow":"inputs/workflow-api.json"},"depends_on":[],"id":"boke-generation","kind":"comfyui-execution"},{"action":{"argv":[],"label":"Start local ComfyUI and run the approved tsukkomi workflow","type":"human"},"arguments":{"bindings":"inputs/bindings.json","endpoint":"http://127.0.0.1:8188","execution_profile":"inputs/execution-profile.json","manifest":"artifacts/comfyui/tsukkomi/execution-manifest.json","model_profile":"inputs/model-profile.json","output_root":"artifacts/comfyui","request":"inputs/tsukkomi/generation-request.json","tool_profile":"inputs/tool-profile.json","workflow":"inputs/workflow-api.json"},"depends_on":[],"id":"tsukkomi-generation","kind":"comfyui-execution"},{"action":{"argv":[],"label":"Review both characters and prepare approved variant export packages before scene planning","type":"human"},"arguments":{"package_root":"artifacts/packages","scene_plan":"artifacts/scenes/scene-plan.json"},"depends_on":["boke-generation","tsukkomi-generation"],"id":"paper-theater-scene","kind":"scene-plan"}],"id":"ai-illustration-workspace-6a180fbeb1e0afa59495","kind":"ai-illustration-workspace","project_name":"Manzai Character AI","schema_version":"1.0"}
